Value,en,Disaggregation combinations using this value,Number of indicators
_L_TLT_FLSEPT,Type of toilet: Pour FlushConnected To Septic Tank,1,1
_L_TLT_FLSEWER,Type of toilet: Pour Flush Connected To Sewerage,1,1
_L_TLT_PLWS,Type of toilet: Pit Latrine With Slab,1,1
_L_TWS_DUGWELL,Type of water source: Protected Dug Well,1,1
_L_TWS_PIPE,Type of water source: Piped In Dwelling Or On Premises,1,1
_L_TWS_PIPEWELL,Type of water source: Tube Piped Well Or Borehole,1,1
_L_TWS_PUBTAP,Type of water source: Public Tap,1,1
_L_TWS_RAINCOLL,Type of water source: Improved Rainwater Collection,1,1
